{"artifacts":[{"cache_key":"sha256/42/42d35340cc5b9ba78e818ddbff0c5b1c2b779de448a340fd1b989f5fa8670e1b/certifi-2026.10.19-py3-none-any.whl","filename":"certifi-2026.10.19-py3-none-any.whl","metadata_sha256":"a5c0be3a42daeef0edfaf58e6ea5b7550f3e4e8eb35420f72e902df9bcf00f5c","metadata_url":"https://files.pythonhosted.org/packages/c4/51/29046e48f693c54e5b7412216d447a1d8362c9653148d98c02cdf65fa733/certifi-2026.10.19-py3-none-any.whl.metadata","name":"certifi","requires_dist":[],"requires_python":">=3.7","sha256":"42d35340cc5b9ba78e818ddbff0c5b1c2b779de448a340fd1b989f5fa8670e1b","size_bytes":136464,"source":"https://pypi.org/pypi/certifi/2026.10.19/json","url":"https://files.pythonhosted.org/packages/c4/51/29046e48f693c54e5b7412216d447a1d8362c9653148d98c02cdf65fa733/certifi-2026.10.19-py3-none-any.whl","version":"2026.10.19"},{"cache_key":"sha256/78/780fbe7cab297b81dad9fb8dc5eb003c0468ffb0d9e5f65068c53a34661a96bc/charset_normalizer-3.5.2-cp312-cp312-win_amd64.whl","filename":"charset_normalizer-3.5.2-cp312-cp312-win_amd64.whl","metadata_sha256":"49e955a09e1a159e0846872798006e8db7d518d8d70c637066fefdb08d3d9f7b","metadata_url":"https://files.pythonhosted.org/packages/eb/e6/e6e083884cbcfd49c64865af05027fe7011be7b2d9179524f099a1b611f3/charset_normalizer-3.5.2-cp312-cp312-win_amd64.whl.metadata","name":"charset-normalizer","requires_dist":[],"requires_python":">=3.7","sha256":"780fbe7cab297b81dad9fb8dc5eb003c0468ffb0d9e5f65068c53a34661a96bc","size_bytes":207486,"source":"https://pypi.org/pypi/charset-normalizer/3.5.2/json","url":"https://files.pythonhosted.org/packages/eb/e6/e6e083884cbcfd49c64865af05027fe7011be7b2d9179524f099a1b611f3/charset_normalizer-3.5.2-cp312-cp312-win_amd64.whl","version":"3.5.2"},{"cache_key":"sha256/4f/4f1d9991f5acc0ca119f9d443620b77f9d6b33703e51011c16baf57afb285fc6/colorama-0.4.6-py2.py3-none-any.whl","filename":"colorama-0.4.6-py2.py3-none-any.whl","metadata_sha256":"7baed29eb50c3b29bdb33ff84e3177bf1bc05784f7685ecdcaa4471c7dd810cc","metadata_url":"https://files.pythonhosted.org/packages/d1/d6/3965ed04c63042e047cb6a3e6ed1a63a35087b6a609aa3a15ed8ac56c221/colorama-0.4.6-py2.py3-none-any.whl.metadata","name":"colorama","requires_dist":[],"requires_python":"!=3.0.*,!=3.1.*,!=3.2.*,!=3.3.*,!=3.4.*,!=3.5.*,!=3.6.*,>=2.7","sha256":"4f1d9991f5acc0ca119f9d443620b77f9d6b33703e51011c16baf57afb285fc6","size_bytes":25335,"source":"https://pypi.org/pypi/colorama/0.4.6/json","url":"https://files.pythonhosted.org/packages/d1/d6/3965ed04c63042e047cb6a3e6ed1a63a35087b6a609aa3a15ed8ac56c221/colorama-0.4.6-py2.py3-none-any.whl","version":"0.4.6"},{"cache_key":"sha256/30/301241438c57936ef93f4243a94f2559022268bfcf9b375a9a72eb0f8db8358e/filelock-4.2.4-py3-none-any.whl","filename":"filelock-4.2.4-py3-none-any.whl","metadata_sha256":"d99c0f72a7ab84c924b734018a28a5001505fe0f96280c4462b864313edddb50","metadata_url":"https://files.pythonhosted.org/packages/e0/1b/5e74289a1878e666bb4b65fe5805a04cafcac2aa5f519ef1ead67ef91c56/filelock-4.2.4-py3-none-any.whl.metadata","name":"filelock","requires_dist":[],"requires_python":">=3.11","sha256":"301241438c57936ef93f4243a94f2559022268bfcf9b375a9a72eb0f8db8358e","size_bytes":162475,"source":"https://pypi.org/pypi/filelock/4.2.4/json","url":"https://files.pythonhosted.org/packages/e0/1b/5e74289a1878e666bb4b65fe5805a04cafcac2aa5f519ef1ead67ef91c56/filelock-4.2.4-py3-none-any.whl","version":"4.2.4"},{"cache_key":"sha256/8d/8dd6e646e99ea382bd85f97a45e6b526a442d79423a7dc673f1e2756d05fcb5f/fsspec-2026.9.0-py3-none-any.whl","filename":"fsspec-2026.9.0-py3-none-any.whl","metadata_sha256":"68f5a262767510638e9b1933b1493f2baadc9616fe1e696f62aedd59c8c0a37c","metadata_url":"https://files.pythonhosted.org/packages/6c/c0/a98505f18594f1bce828bb159cec0fcf9860562f1a2c85913409fc8f3d9e/fsspec-2026.9.0-py3-none-any.whl.metadata","name":"fsspec","requires_dist":["adlfs; extra == 'abfs'","adlfs; extra == 'adl'","pyarrow>=1; extra == 'arrow'","dask; extra == 'dask'","distributed; extra == 'dask'","pre-commit; extra == 'dev'","ruff>=0.5; extra == 'dev'","numpydoc; extra == 'doc'","sphinx; extra == 'doc'","sphinx-design; extra == 'doc'","sphinx-rtd-theme; extra == 'doc'","yarl; extra == 'doc'","dropbox; extra == 'dropbox'","dropboxdrivefs; extra == 'dropbox'","requests; extra == 'dropbox'","adlfs; extra == 'full'","aiohttp!=4.0.0a0,!=4.0.0a1; extra == 'full'","dask; extra == 'full'","distributed; extra == 'full'","dropbox; extra == 'full'","dropboxdrivefs; extra == 'full'","fusepy; extra == 'full'","gcsfs>=2026.4.0; extra == 'full'","libarchive-c; extra == 'full'","ocifs; extra == 'full'","panel; extra == 'full'","paramiko; extra == 'full'","pyarrow>=1; extra == 'full'","pygit2; extra == 'full'","requests; extra == 'full'","s3fs>=2026.6.0; extra == 'full'","smbprotocol; extra == 'full'","tqdm; extra == 'full'","fusepy; extra == 'fuse'","gcsfs>=2026.4.0; extra == 'gcs'","pygit2; extra == 'git'","requests; extra == 'github'","gcsfs>=2026.4.0; extra == 'gs'","panel; extra == 'gui'","pyarrow>=1; extra == 'hdfs'","aiohttp!=4.0.0a0,!=4.0.0a1; extra == 'http'","libarchive-c; extra == 'libarchive'","ocifs; extra == 'oci'","s3fs>=2026.6.0; extra == 's3'","paramiko; extra == 'sftp'","smbprotocol; extra == 'smb'","paramiko; extra == 'ssh'","aiohttp!=4.0.0a0,!=4.0.0a1; extra == 'test'","numpy; extra == 'test'","pytest; extra == 'test'","pytest-asyncio!=0.22.0; extra == 'test'","pytest-benchmark; extra == 'test'","pytest-cov; extra == 'test'","pytest-mock; extra == 'test'","pytest-recording; extra == 'test'","pytest-rerunfailures; extra == 'test'","requests; extra == 'test'","aiobotocore<3.0.0,>=2.5.4; extra == 'test-downstream'","dask[dataframe,test]; extra == 'test-downstream'","moto[server]<5,>4; extra == 'test-downstream'","pytest-timeout; extra == 'test-downstream'","xarray; extra == 'test-downstream'","zarr; extra == 'test-downstream'","adlfs; extra == 'test-full'","aiohttp!=4.0.0a0,!=4.0.0a1; extra == 'test-full'","backports-zstd; (python_version < '3.14') and extra == 'test-full'","cloudpickle; extra == 'test-full'","dask; extra == 'test-full'","distributed; extra == 'test-full'","dropbox; extra == 'test-full'","dropboxdrivefs; extra == 'test-full'","fastparquet; extra == 'test-full'","fusepy; extra == 'test-full'","gcsfs>=2026.4.0; extra == 'test-full'","jinja2; extra == 'test-full'","kerchunk; extra == 'test-full'","libarchive-c; extra == 'test-full'","lz4; extra == 'test-full'","notebook; extra == 'test-full'","numpy; extra == 'test-full'","ocifs; extra == 'test-full'","pandas<3.0.0; extra == 'test-full'","panel; extra == 'test-full'","paramiko; extra == 'test-full'","pyarrow>=1; extra == 'test-full'","pyftpdlib; extra == 'test-full'","pygit2; extra == 'test-full'","pytest; extra == 'test-full'","pytest-asyncio!=0.22.0; extra == 'test-full'","pytest-benchmark; extra == 'test-full'","pytest-cov; extra == 'test-full'","pytest-mock; extra == 'test-full'","pytest-recording; extra == 'test-full'","pytest-rerunfailures; extra == 'test-full'","python-snappy; extra == 'test-full'","requests; extra == 'test-full'","s3fs>=2026.6.0; extra == 'test-full'","smbprotocol; extra == 'test-full'","tqdm; extra == 'test-full'","urllib3; extra == 'test-full'","zarr<3.2.0; extra == 'test-full'","zstandard; (python_version < '3.14') and extra == 'test-full'","tqdm; extra == 'tqdm'"],"requires_python":">=3.10","sha256":"8dd6e646e99ea382bd85f97a45e6b526a442d79423a7dc673f1e2756d05fcb5f","size_bytes":221738,"source":"https://pypi.org/pypi/fsspec/2026.9.0/json","url":"https://files.pythonhosted.org/packages/6c/c0/a98505f18594f1bce828bb159cec0fcf9860562f1a2c85913409fc8f3d9e/fsspec-2026.9.0-py3-none-any.whl","version":"2026.9.0"},{"cache_key":"sha256/7b/7bcc9ad17d5b3f07b57c78e79d527102d08313caa278a641993acddcb894548d/huggingface_hub-0.36.0-py3-none-any.whl","filename":"huggingface_hub-0.36.0-py3-none-any.whl","metadata_sha256":"26ce80563d3402f2935b7d881835b9b1a64d897dc2f986f52bf4114642de71ad","metadata_url":"https://files.pythonhosted.org/packages/cb/bd/1a875e0d592d447cbc02805fd3fe0f497714d6a2583f59d14fa9ebad96eb/huggingface_hub-0.36.0-py3-none-any.whl.metadata","name":"huggingface-hub","requires_dist":["filelock","fsspec>=2023.5.0","packaging>=20.9","pyyaml>=5.1","requests","tqdm>=4.42.1","typing-extensions>=3.7.4.3","hf-xet<2.0.0,>=1.1.3; platform_machine == \"x86_64\" or platform_machine == \"amd64\" or platform_machine == \"arm64\" or platform_machine == \"aarch64\"","InquirerPy==0.3.4; extra == \"all\"","aiohttp; extra == \"all\"","authlib>=1.3.2; extra == \"all\"","fastapi; extra == \"all\"","httpx; extra == \"all\"","itsdangerous; extra == \"all\"","jedi; extra == \"all\"","Jinja2; extra == \"all\"","pytest<8.2.2,>=8.1.1; extra == \"all\"","pytest-cov; extra == \"all\"","pytest-env; extra == \"all\"","pytest-xdist; extra == \"all\"","pytest-vcr; extra == \"all\"","pytest-asyncio; extra == \"all\"","pytest-rerunfailures<16.0; extra == \"all\"","pytest-mock; extra == \"all\"","urllib3<2.0; extra == \"all\"","soundfile; extra == \"all\"","Pillow; extra == \"all\"","gradio>=4.0.0; extra == \"all\"","numpy; extra == \"all\"","ruff>=0.9.0; extra == \"all\"","libcst>=1.4.0; extra == \"all\"","ty; extra == \"all\"","typing-extensions>=4.8.0; extra == \"all\"","types-PyYAML; extra == \"all\"","types-requests; extra == \"all\"","types-simplejson; extra == \"all\"","types-toml; extra == \"all\"","types-tqdm; extra == \"all\"","types-urllib3; extra == \"all\"","mypy<1.15.0,>=1.14.1; python_version == \"3.8\" and extra == \"all\"","mypy==1.15.0; python_version >= \"3.9\" and extra == \"all\"","InquirerPy==0.3.4; extra == \"cli\"","InquirerPy==0.3.4; extra == \"dev\"","aiohttp; extra == \"dev\"","authlib>=1.3.2; extra == \"dev\"","fastapi; extra == \"dev\"","httpx; extra == \"dev\"","itsdangerous; extra == \"dev\"","jedi; extra == \"dev\"","Jinja2; extra == \"dev\"","pytest<8.2.2,>=8.1.1; extra == \"dev\"","pytest-cov; extra == \"dev\"","pytest-env; extra == \"dev\"","pytest-xdist; extra == \"dev\"","pytest-vcr; extra == \"dev\"","pytest-asyncio